{"candidate":{"mutations":[{"from":"auto","target":"pnr.die_um","to":"210x210"},{"from":"0.30","target":"pnr.placement_density","to":"0.60"},{"from":"0.02","target":"pnr.spare_cell_density","to":"0.05"}]},"contract_digest":"sha256:e44b7d599867a975eeb1cfa75ca4a9d65a29b6bd3aa910911eca20e9c6d424f8","declared_facts":[{"identity":"problem","key":"constraints.clk.period_ns","source":"sdc","source_path":"phase2/stage2/constraints/spm.sdc","value":10.0},{"identity":"agent_execution","key":"agent.autonomy","source":"declared","value":"none"},{"identity":"implementation","key":"pnr.die_um","source":"runner_invocation","value":"210x210"},{"identity":"implementation","key":"pnr.spare_cell_density","source":"runner_invocation","value":"0.05"},{"identity":"implementation","key":"pnr.placement_density","source":"runner_invocation","value":"0.60"},{"identity":"problem","key":"pdk.target","source":"l19_spec","source_path":"phase1/generated_docs/L19_CONSTRAINTS_PDK.json","value":"sky130"},{"identity":"analysis","key":"analysis.stage","source":"runner","value":"post_route_extracted"},{"identity":"agent_execution","key":"agent.role","source":"declared","value":"deterministic_runner_only"},{"identity":"analysis","key":"analysis.activity_basis","source":"runner","value":"VECTORLESS"}],"evidence_manifest":{"artefacts":[{"bytes":260,"path":"reports/phase3/antenna.json","role":"antenna","sha256":"sha256:b7f0ce59ac873298e8a8c60ac447cc576a14e698681da0cd2d4aea4973819062","status":"MEASURED"},{"bytes":971,"path":"phase2/stage2/constraints/pvt_matrix.json","role":"corner_mode_declaration","sha256":"sha256:8569748aec9d0ae26d39bdc90b8e3bbfbae0b73af67fc7186196b7041437e725","status":"MEASURED"},{"bytes":22379,"path":"reports/phase3/drc_signoff.rpt","role":"drc_signoff","sha256":"sha256:4da3883acc7432f3e6efab3516117cef476bdd439bd55422f6b151446c541e1e","status":"MEASURED"},{"bytes":3998,"path":"reports/phase3/drc_vacuous.json","role":"drc_vacuity","sha256":"sha256:501b8e5283272b5afa5af947bf103f4aac9c46c21a35d2f8b1191d228995a9ac","status":"MEASURED"},{"bytes":226154,"path":"phase3/stage3/pnr/spm_pnr.v","role":"gate_netlist","sha256":"sha256:e7b048454cb3ca8e7553895e993136f50d273f7bca762e57c09e318e9938a23e","status":"MEASURED"},{"bytes":1956590,"path":"phase3/stage4/gds/spm.gds","role":"gds","sha256":"sha256:799cb3075e78d362cec9b4edcfd359972c46453a64de1869a8ca7d0b06a5f001","status":"MEASURED"},{"bytes":1070,"path":"phase1/generated_docs/L19_CONSTRAINTS_PDK.json","role":"l19_spec","sha256":"sha256:717f38a3d0cfc171c9b0cb630d2c229514be0497042c409fad1627ef6e97d026","status":"MEASURED"},{"bytes":50230,"path":"reports/phase3/lvs.rpt","role":"lvs","sha256":"sha256:f59ef63c8befeb32c1497f6d0e293807d75aaed9a8ef86e0faf953d8ead8eb97","status":"MEASURED"},{"bytes":2322,"path":"reports/phase3/power.rpt","role":"power","sha256":"sha256:0b396df0e27ee2d8855799fc8e10f980a1ccc007649d9f48f35d2355417a47ea","status":"MEASURED"},{"bytes":1379,"path":"reports/phase3/multi_corner_spef_stance.json","role":"rc_corner_stance","sha256":"sha256:8d2299f0bcd94a6ee735c90d330792889aed8301d0f2c60dbddf3af950ab6e90","status":"MEASURED"},{"bytes":854409,"path":"phase3/stage3/pnr/spm.def","role":"routed_def","sha256":"sha256:056255dbc08b598f8808a9024c309f02445a3649f9af4268d684c57d75a2879c","status":"MEASURED"},{"bytes":5442,"path":"phase2/stage1/rtl/spm.v","role":"rtl_top","sha256":"sha256:e7feff2cbbad384aa5fa3011bf23ceecf0bd4e1f711bf1c7544f94cd2f995424","status":"MEASURED"},{"bytes":1049,"path":"phase2/stage2/constraints/spm.sdc","role":"sdc","sha256":"sha256:74b39a3339ede80a74203dd2b2f0de2dc33b0d64f4ffad557c863bbb2232c965","status":"MEASURED"},{"bytes":11670,"path":"phase3/stage3/sta/sta_spef_multicorner.rpt","role":"sta_signoff_multicorner","sha256":"sha256:d3472f672555294f30baf8f02ac2ba1e954ec49d5d708a89d68747730fc7230b","status":"MEASURED"},{"bytes":11697,"path":"phase3/stage3/sta/sta_mcorner_ocv.rpt","role":"sta_signoff_ocv","sha256":"sha256:a8867f0c95227894c8f0120ec5c78527f21cfa981fde8d4437264a40165634eb","status":"MEASURED"},{"bytes":2382,"path":"phase3/stage3/sta/sta_spef_based.rpt","role":"sta_single_corner","sha256":"sha256:17aae6a934a021cc6d07c5868b8da73a6f622ea5d58f568af2fb18e545f90a60","status":"MEASURED"}],"measured_count":16,"not_measured_count":0,"schema":"vibeic.ppa.evidence_manifest.v1"},"identities":{"agent_execution":{"digest":"sha256:da4104a7c9537b82176695f18aa7998eaf319d4fdfeac175766ed7df63291c99","kind":"agent_execution","members":{"artefacts":[],"facts":[{"key":"agent.autonomy","value":"none"},{"key":"agent.role","value":"deterministic_runner_only"}]},"schema":"vibeic.ppa.identity.v1","status":"MEASURED"},"analysis":{"digest":"sha256:6c4f5356d6369d7e78c4480730d3349260710e5c2bbc72b5db1f5da2a051a043","kind":"analysis","members":{"artefacts":[{"role":"corner_mode_declaration","sha256":"sha256:8569748aec9d0ae26d39bdc90b8e3bbfbae0b73af67fc7186196b7041437e725"},{"role":"rc_corner_stance","sha256":"sha256:8d2299f0bcd94a6ee735c90d330792889aed8301d0f2c60dbddf3af950ab6e90"}],"facts":[{"key":"analysis.activity_basis","value":"VECTORLESS"},{"key":"analysis.stage","value":"post_route_extracted"}]},"schema":"vibeic.ppa.identity.v1","status":"MEASURED"},"implementation":{"digest":"sha256:54f4d0f28069e4de151694e9490359bed327801be739e219966fce0a259f2a8b","kind":"implementation","members":{"artefacts":[{"role":"antenna","sha256":"sha256:b7f0ce59ac873298e8a8c60ac447cc576a14e698681da0cd2d4aea4973819062"},{"role":"drc_signoff","sha256":"sha256:4da3883acc7432f3e6efab3516117cef476bdd439bd55422f6b151446c541e1e"},{"role":"drc_vacuity","sha256":"sha256:501b8e5283272b5afa5af947bf103f4aac9c46c21a35d2f8b1191d228995a9ac"},{"role":"gate_netlist","sha256":"sha256:e7b048454cb3ca8e7553895e993136f50d273f7bca762e57c09e318e9938a23e"},{"role":"gds","sha256":"sha256:799cb3075e78d362cec9b4edcfd359972c46453a64de1869a8ca7d0b06a5f001"},{"role":"lvs","sha256":"sha256:f59ef63c8befeb32c1497f6d0e293807d75aaed9a8ef86e0faf953d8ead8eb97"},{"role":"power","sha256":"sha256:0b396df0e27ee2d8855799fc8e10f980a1ccc007649d9f48f35d2355417a47ea"},{"role":"routed_def","sha256":"sha256:056255dbc08b598f8808a9024c309f02445a3649f9af4268d684c57d75a2879c"},{"role":"sta_signoff_multicorner","sha256":"sha256:d3472f672555294f30baf8f02ac2ba1e954ec49d5d708a89d68747730fc7230b"},{"role":"sta_signoff_ocv","sha256":"sha256:a8867f0c95227894c8f0120ec5c78527f21cfa981fde8d4437264a40165634eb"},{"role":"sta_single_corner","sha256":"sha256:17aae6a934a021cc6d07c5868b8da73a6f622ea5d58f568af2fb18e545f90a60"}],"facts":[{"key":"pnr.die_um","value":"210x210"},{"key":"pnr.placement_density","value":"0.60"},{"key":"pnr.spare_cell_density","value":"0.05"}]},"schema":"vibeic.ppa.identity.v1","status":"MEASURED"},"problem":{"digest":"sha256:9131c318eb2013f0d3c34f48c3080d4aef58e72735911509e655e423e3160c7c","kind":"problem","members":{"artefacts":[{"role":"l19_spec","sha256":"sha256:717f38a3d0cfc171c9b0cb630d2c229514be0497042c409fad1627ef6e97d026"},{"role":"rtl_top","sha256":"sha256:e7feff2cbbad384aa5fa3011bf23ceecf0bd4e1f711bf1c7544f94cd2f995424"},{"role":"sdc","sha256":"sha256:74b39a3339ede80a74203dd2b2f0de2dc33b0d64f4ffad557c863bbb2232c965"}],"facts":[{"key":"constraints.clk.period_ns","value":10.0},{"key":"pdk.target","value":"sky130"}]},"schema":"vibeic.ppa.identity.v1","status":"MEASURED"},"toolchain":{"digest":"sha256:d5dd52cbf953328c37177d2e44b9e38dfa82cb80bf7941b8d4d64f43ea803832","kind":"toolchain","members":{"artefacts":[],"facts":[{"key":"image.eda","value":"sha256:24b5074b686386084f87a03712b5f76e475201fbf2f2583b112d6e2c3eb55f3d"}]},"schema":"vibeic.ppa.identity.v1","status":"MEASURED"}},"metrics":[],"policy":{"missing_power_basis":"REFUSE","mutation_allow_list":["pnr.*"],"mutation_forbidden":["constraints.*","pdk.*","rtl.*"]},"resolutions":[],"run_label":"t029","run_manifest":{"artefacts":[{"bytes":260,"path":"reports/phase3/antenna.json","role":"antenna","sha256":"sha256:b7f0ce59ac873298e8a8c60ac447cc576a14e698681da0cd2d4aea4973819062","status":"MEASURED"},{"bytes":971,"path":"phase2/stage2/constraints/pvt_matrix.json","role":"corner_mode_declaration","sha256":"sha256:8569748aec9d0ae26d39bdc90b8e3bbfbae0b73af67fc7186196b7041437e725","status":"MEASURED"},{"bytes":22379,"path":"reports/phase3/drc_signoff.rpt","role":"drc_signoff","sha256":"sha256:4da3883acc7432f3e6efab3516117cef476bdd439bd55422f6b151446c541e1e","status":"MEASURED"},{"bytes":3998,"path":"reports/phase3/drc_vacuous.json","role":"drc_vacuity","sha256":"sha256:501b8e5283272b5afa5af947bf103f4aac9c46c21a35d2f8b1191d228995a9ac","status":"MEASURED"},{"bytes":226154,"path":"phase3/stage3/pnr/spm_pnr.v","role":"gate_netlist","sha256":"sha256:e7b048454cb3ca8e7553895e993136f50d273f7bca762e57c09e318e9938a23e","status":"MEASURED"},{"bytes":1956590,"path":"phase3/stage4/gds/spm.gds","role":"gds","sha256":"sha256:799cb3075e78d362cec9b4edcfd359972c46453a64de1869a8ca7d0b06a5f001","status":"MEASURED"},{"bytes":1070,"path":"phase1/generated_docs/L19_CONSTRAINTS_PDK.json","role":"l19_spec","sha256":"sha256:717f38a3d0cfc171c9b0cb630d2c229514be0497042c409fad1627ef6e97d026","status":"MEASURED"},{"bytes":50230,"path":"reports/phase3/lvs.rpt","role":"lvs","sha256":"sha256:f59ef63c8befeb32c1497f6d0e293807d75aaed9a8ef86e0faf953d8ead8eb97","status":"MEASURED"},{"bytes":2322,"path":"reports/phase3/power.rpt","role":"power","sha256":"sha256:0b396df0e27ee2d8855799fc8e10f980a1ccc007649d9f48f35d2355417a47ea","status":"MEASURED"},{"bytes":1379,"path":"reports/phase3/multi_corner_spef_stance.json","role":"rc_corner_stance","sha256":"sha256:8d2299f0bcd94a6ee735c90d330792889aed8301d0f2c60dbddf3af950ab6e90","status":"MEASURED"},{"bytes":854409,"path":"phase3/stage3/pnr/spm.def","role":"routed_def","sha256":"sha256:056255dbc08b598f8808a9024c309f02445a3649f9af4268d684c57d75a2879c","status":"MEASURED"},{"bytes":5442,"path":"phase2/stage1/rtl/spm.v","role":"rtl_top","sha256":"sha256:e7feff2cbbad384aa5fa3011bf23ceecf0bd4e1f711bf1c7544f94cd2f995424","status":"MEASURED"},{"bytes":1049,"path":"phase2/stage2/constraints/spm